{
  "schema_version": 1,
  "candidate_id": "candidate_example_001",
  "source_id": "authorized_example_source",
  "start_ms": 9800,
  "end_ms": 40200,
  "status": "eligible",
  "title": "Timestamps are the proof layer",
  "why_now": "The speaker states the decisive editing rule and immediately explains its consequence.",
  "evidence": [
    {
      "kind": "transcript",
      "artifact": "transcript.json",
      "start_ms": 9800,
      "end_ms": 40200,
      "observation": "Host states the timestamp rule and its consequence.",
      "verbatim": "If the timestamp is wrong, the edit is built on nothing."
    },
    {
      "kind": "visual",
      "artifact": "source.mp4",
      "start_ms": 12000,
      "end_ms": 40000,
      "observation": "Host faces camera; animated timestamp overlay appears during the rule."
    }
  ]
}
